{
  "list_id": "arky:revocations@v1",
  "issuer": "https://provider.example",
  "ts": "2025-10-15T00:00:00Z",
  "entries": [
    {
      "kind": "jwks",
      "kid": "key-2025-01",
      "reason": "rotation",
      "revoked_at": "2025-10-15T23:59:59Z"
    },
    {
      "kind": "registry",
      "id": "c0ffee00c0ffee00c0ffee00c0ffee00c0ffee00c0ffee00c0ffee00c0ffee00",
      "reason": "compromise",
      "revoked_at": "2025-10-12T08:00:00Z"
    }
  ],
  "sig": "eyJhbGciOiJFZERTQSJ9.eyJzdWIiOiJyZXZvY2F0aW9ucyJ9.placeholder_signature_value"
}
