{
  "list_id": "arky:revocations@v1",
  "issuer": "https://provider.example.com",
  "ts": "2025-10-15T00:00:00Z",
  "entries": [
    {
      "kind": "jwks",
      "kid": "provider-key-rotated",
      "reason": "rotation",
      "revoked_at": "2025-10-15T23:59:59Z"
    }
  ],
  "sig": "eyJhbGciOiJFZERTQSIsInR5cCI6IkpXUyIsImtpZCI6InRlc3Qta2V5LTIwMjUtMDEifQ.eyJlbnRyaWVzIjpbeyJraWQiOiJwcm92aWRlci1rZXktcm90YXRlZCIsImtpbmQiOiJqd2tzIiwicmVhc29uIjoicm90YXRpb24iLCJyZXZva2VkX2F0IjoiMjAyNS0xMC0xNVQyMzo1OTo1OVoifV0sImlzc3VlciI6Imh0dHBzOi8vcHJvdmlkZXIuZXhhbXBsZS5jb20iLCJsaXN0X2lkIjoiYXJreTpyZXZvY2F0aW9uc0B2MSIsInRzIjoiMjAyNS0xMC0xNVQwMDowMDowMFoifQ.amH_eLdpaUJkKK-mNh5zIItLIMiaMc6yTiz9UhCMT5IZtVG_J0ZlHesrrRuxxz7NfnFtSMw6tpp2n9ef9dndCw"
}
